headline,description,url
Newly Installed CBD Waste Bins Destroyed,"Nairobi County is counting losses after the newly installed dustbins, which are barely a month old, were destroyed by angry protestors.
The protestors, who took to the streets on Thursday to demonstrate against the recent death of Albert Ojwang, were seen uninstalling the bins.
In videos seen by Kenyans.co.ke, a number of the bins were removed from their original posts, with the protestors carrying them along the road, as they dragged them along.
The bins were installed barely a month ago to help keep the city clean, as the county embarks on empowering a cleaner city.
Nairobi Chief Environment Officer Geoffrey Mosiria posing with a newly installed dustbin on in Nairobi CBD on Sunday, May 18, 2025. PHOTO GEOFFREY MOSIRIA
Initially, when installed, the county had issued stern warnings to both city dwellers and hawkers against destroying them.
Speaking when the installation kicked off on Sunday, May 18, Nairobi County Chief Officer for Environment, Mosiria, stated that the bins were put in place to serve pedestrians, after the previously installed ones were stolen.
The bins were purely designated for Nairobians and pedestrians, with business owners sent a stern warning not to dump their commercial waste in the bins.
""Importantly, these dustbins are strictly meant for use by pedestrians and not for hawkers, vendors, or business owners,"" the county official had warned.
Nairobi residents had complained to the county that the city lacked bins, making it difficult for them to practice hygiene. After numerous complaints, the county heeded the pleas and installed the bins, which have now been destroyed.
The first batch of bins had been placed in high-traffic areas, with plans to expand into neighborhoods, parks, and transport hubs soon.
Governor Sakaja had emphasized that the bins were more than just waste containers but symbolized order, hygiene, and modernity in Nairobi.
To ensure the bins would be well taken care of and not destroyed, the county offered a Ksh5,000 reward to residents who reported cases of bin vandalism.
Condemning the vandalism, Mosiria acknowledged the youths' right to picket but urged them to exercise restraint, emphasizing that demonstrations should not be an excuse for destruction of property in the city.
Waste bins installed in Nairobi CBD by the County Government, May 18, 2025. PHOTO JOHNSON SAKAJA",https://www.kenyans.co.ke/news/113056-nairobi-countys-newly-installed-cbd-dustbins-destroyed-during-protests
UDA Politician Dies,"Nanam Ward MCA and UDA party member Philip Ekuwam Lomuria has died, the party has confirmed.
In a statement shared by the UDA Party Secretary-General, Hassan Omar, he confirmed that the lawmaker, who had also been serving as the Deputy Speaker of Turkana County, passed away, without providing the circumstances around his passing.
""Until his death, Lomuria, who also served as the Deputy Speaker of the Turkana County Assembly, was a staunch and dedicated member of the UDA Party, who exhibited zeal in undertaking his duties as a legislator at the County Assembly,"" the statement read in part. 
""As the family, the County Assembly, and indeed the residents of Turkana County mourn the loss of their loved one and leader, the UDA Party sends its sincere condolences and stands in solidarity with them at this time of grief.""
The late Nanam MCA Philip Ekuwam during a past event. PHOTO TURKANA COUNTY ASSEMBLY
According to Turkana County Assembly Speaker Charles Ewoi, Ekuwam passed away while undergoing treatment at the hospital following an illness.
In his statement, Ewoi described the late Deputy Speaker as a dedicated and principled leader who served the people of Nanam Ward with distinction.
Ekuwam was first elected in 2013 and served as Deputy Speaker during his initial term. He was re-elected in 2022 and continued in the same capacity until his demise.
''His legacy of service, unity, and leadership will be remembered. We extend our heartfelt condolences to his family, the people of Nanam Ward, and all who knew him,'' the Speaker stated.
On November 13, last year, UDA suffered another setback after losing one of its key MCAs in Murang’a. The MCA, Mark Wainaina, died while undergoing treatment for an ailment that had plagued him for a while.
Wainaina was diagnosed with a severe pulmonary disease that had caused his lungs to fail, prompting the family to take him to the hospital.
Wainana, who was a nominated MCA, was admitted to the Intensive Care Unit at one of the hospitals after his condition worsened.
President William Ruto led other Kenyans and leaders in mourning the late Wainaina, describing him as a friendly and witty person with immense potential.
UDA Party Secretary General Hassan Omar. PHOTO/ UDA",https://www.kenyans.co.ke/news/113054-nanam-ward-mca-philip-ekuwam-dies
Govt Agency Intervenes After Woman Miscarries in Police Custody,"The National Gender and Equality Commission (NGEC) is demanding answers from the National Police Service (NPS) after reports of a pregnant woman suffering a miscarriage at seven months while in police custody.
In a statement on Thursday, June 12, the commission called for prompt investigations into the matter, accountability, and, ultimately, gender-responsive policing reforms to deter recurrence.
""A pregnant woman allegedly suffered a miscarriage while in police custody—an unconscionable tragedy that demands answers. The Commission calls for immediate investigation, accountability, and gender-responsive policing reforms,"" part of the statement read.
NGEC highlighted the importance of having systems that safeguard pregnant mothers in custody, emphasising that maternal health was a right that needed protecting.
An undated image of the National Gender and Equality Commission (NGEC) chairperson Rehema Jaldesa. PHOTO REHEMA JALDESA
To achieve this, the commission called for mandatory training of police officers on how to handle similar cases to minimise casualties in police custody. 
""Pregnancy should be protected, even behind bars. Maternal health must never be collateral damage in law enforcement processes,"" the statement read in part.
""Enough is enough. We must sensitise police officers—with data, training & empathy—on the rights of special interest groups. Fairness. Accountability. Dignity. Now. We urgently call on IPOA and NPS to launch swift, transparent investigations and ensure accountability.""
Reports of the woman miscarrying in custody broke on Wednesday, with her family revealing that she was seven months pregnant and had complained upon her booking at the station in Kinangop, Nyandarua County.
She had repeatedly been arrested after her employer filed a complaint saying that Ksh18,000 from a day's sales was missing. Later, it was discovered that only Ksh9,000 was missing, and the family managed to raise Ksh6,000.
Despite pleas by the family to the complainant to wait until the next day to come up with the remaining Ksh3,000, he refused to hear their complaints, and she was locked up for the night.
""I pleaded with the police to release my sister as we tried to raise the money on Wednesday, but they declined. I pleaded with them, informing them that my sister had other children waiting at home and we had a sick mother to take care of, but they refused,"" the victim's sister stated.
While in custody, she reportedly complained of severe abdominal pain and pleaded for medical attention, which was allegedly ignored by the officers.
At around 1 am, the victim called her sister to inform her that she needed assistance since she was bleeding heavily. She rushed to the station but was reportedly chased away.
Witnesses and family members claim that the woman began experiencing complications but was left unattended for hours, leading to the tragic loss of her pregnancy.
A police station in Kenya. PHOTO NPS",https://www.kenyans.co.ke/news/113052-ngec-calls-accountability-nps-and-ipoa-after-woman-miscarries-custody
