headline,description,url
MMFs vs SACCOs: Where Should You Put Your Money in 2025 and Beyond?,"As more Kenyans look for ways to grow their money outside of traditional banking, SACCOs and Money Market Funds have emerged as two reliable options. But how do you decide which one suits you best?
Kenyans.co.ke spoke to Jeremiah Odera, a financial expert who has been in the industry for over eight years and has been investing with the traditional banks, SACCOs, and MMFs to give us a detailed insight into how the three operate. 
Understanding the Basics
SACCOs are member-owned cooperatives that offer savings and loans at affordable rates. Members pool their resources to provide credit to one another. On the other hand, MMFs are unit trusts that invest in short-term, low-risk financial instruments like Treasury bills, commercial paper, and bank deposits.
MMFs typically offer an annual net return of 8–11 per cent, depending on the fund manager and market performance. These returns are calculated daily and compounded monthly. SACCOs, meanwhile, pay dividends and interest on deposits, often ranging between 8–10 per cent annually, based on the SACCO’s profitability and policies.
Liquidity and Access to Funds
MMFs provide high liquidity—most allow withdrawals within 24 to 72 hours. This makes them suitable for short-term goals and emergency funds. SACCOs, however, often have limited withdrawal options, as deposits are intended to build long-term savings and qualify for loans.
An image illustratin money saving tips GOODHOUSEKEEPING
According to Odera, generally, if one is considering both a future investment scheme and a wealth-building plan, then SACCOs offer the ideal investment destination.
""If you are looking to build wealth, then SACCOs are the ideal investment destinations. MMFs, on the other hand, are good but ideal for quick money; what is referred to [as] a high liquidity option. This means that in MMFs you can easily get back money, but with SACCOs you have to save for some duration, usually three to five years, to be considered for loans,"" Odera said.
Loan Accessibility
SACCOs shine when it comes to borrowing. Members can access loans at relatively low interest rates, typically 8 per annum, after a few years of saving. MMFs do not offer credit facilities, making them less ideal if you're also looking to borrow.
MMFs, however, depend on the interest rates they offer, which are tied to key economic factors such as the stability of the shilling, and the Central Bank of Kenya sets base lending rates. 
''In as much as MMFs have fluctuations in rates, with SACCOs, just be assured that the rates can never go down. The beauty is that you earn dividends on your investments, you are simply a shareholder in a SACCO,’’ Odera added.
A photo collage of Central Bank of Kenya governor and shilling notes and coins PHOTO CBK
When it comes to savings, some SACCOs offer to buy out existing bank loans for their members. The advantage is that you then repay the loan at the SACCO's interest rates, which are often lower than those charged by banks.
Risk and Regulation
MMFs are regulated by the Capital Markets Authority (CMA) and managed by licensed fund managers. They are generally considered safe, though not risk-free. SACCOs are regulated by SASRA (SACCO Societies Regulatory Authority), but risk varies depending on the SACCO's governance and financial health.
Experts advise that you shop around for the best SACCO with no historical cases of governance and management issues.
Charges
MMFs may have minimal management fees that slightly impact returns, but these are generally low. SACCOs, on the other hand, may charge membership, maintenance, and loan processing fees, though experts note that SACCO loan processing fees are often lower than those of traditional banks.
If you are considering a loan, SACCOs are usually a better option than banks due to their favourable interest rates, especially if you have consistent savings and a reasonable repayment period.
Consider joining a SACCO if you are looking for affordable loans, value a community-based financial model, and are committed to regular saving.
Expert Tip: Diversify
Experts advise that you do not have to choose just one savings point. Savvy savers should split their funds, putting part into MMFs for liquidity and part into SACCOs for long-term financial planning and loan access.
Both SACCOs and MMFs offer valuable benefits depending on your financial goals. Understanding their differences in structure, returns, accessibility, and risk can help you make an informed decision and grow your wealth with confidence.
Odera, however, advises that one should study the market carefully, along with the various factors that influence it.
""The shilling has been fairly stable against the dollar for the last eight months, and ideally, this is the best time to try the MMFs,"" Odera pointed out.
""In summary, it is good to create what is referred to as a portfolio in finance. It is good to have your money across the different investment and savings schemes; they often become handy.""
Kenyan currency on display. KENYANS.CO.KE",https://www.kenyans.co.ke/news/114282-saccos-vs-money-market-funds-where-should-you-invest-2025
MPs Grill CA Boss Over Media Blackout During Demos,"Members of Parliament from the Public Investment Committee have warned the Communications Authority of Kenya (CA's) Director General, David Mugonyi, against pushing Kenya towards anarchy after a recent directive ordering the shutdown of televisions.
The CA elicited tensions in the country after ordering all radio and TV stations to stop livestreaming the June 25 protests. The CA went further to shut down several stations that continued streaming.
The directive elicited tensions in the country as questions built up on media freedom.
During the session that took place on Thursday, July 17, MPs led by the chairperson, Caleb Amisi, grilled Mugonyi over the legality and implications of the blackout, warning that such actions risk undermining Kenya’s democratic foundations.
Communications Authority of Kenya Headquarters PHOTO COMMUNICATIONS AUTHORITY OF KENYA
“If we are going to look for a loophole to move out of that law, we are still going back to anarchy. Do not become an agent of anarchy. It will be bad for this country,” warned MP Amisi.
The June 25 directive in question cited alleged violations of Articles 33(2) and 34(1) of the Constitution, as well as Section 461 of the Kenya Information and Communications Act. In the notice, CA Director-General David Mugonyi warned broadcasters that failure to comply would result in regulatory action, including possible license suspension.
However, Members of Parliament challenged the Authority, accusing it of overstepping its mandate.
“Do not become an agent of anarchy. It may feel comfortable for you now, but the repercussions for this country will be felt for years to come,” Amisi reiterated.
The committee maintained that any regulation of the media must be anchored in the law and follow due process, not be based on arbitrary or punitive directives.
“Rwanda went down with just a click of a rogue person in the media. Countries have collapsed because one person followed unlawful orders from another rogue leader,” the committee noted.
Echoing Amisi’s sentiments, another member emphasised that Kenya had made significant democratic progress that must not be undone.
“Let us not destroy what we’ve built. We want a better Kenya today and tomorrow. Let the media be responsible, yes, but let you also be responsible. Let all of us be responsible so that whatever we do today is protected tomorrow,” the MP added.
On his part, Mugonyi defended the move, maintaining that the CA was acting on its rightful mandate as stipulated in the constitution.
“I would say the CA is guided by the Constitution and rightfully put Article 33 and 34 of the Constitution of Kenya. We are also guided by the Kenya Information and Communication Act, Section 461, on issues at hand when the media is to be limited,” Mugonyi maintained.
Communication Authority Director General David Mugonyi during a National Assembly committee meeting on November 5, 2024. PHOTO NATIONAL ASSEMBLY",https://www.kenyans.co.ke/news/114281-ca-warned-against-switching-tv-stations-urged-practice-fairness
Police Officer Found Dead by Roadside,"Investigations have been launched into the gruesome killing of a police officer, whose body was found dumped by the roadside in Rarieda, Siaya County.
According to an official report obtained by Kenyans.co.ke., the lifeless body of the police constable was discovered along the Ndori–Luanda Kotieno road, near Rarieda Secondary School.
What was more puzzling was the fact that the officer's body was discovered just two kilometres from the police station where he was reportedly posted.
The body's discovery was made by another officer in the wee hours of Thursday morning. The officer reported the matter, prompting a response team led by Rarieda Sub-County Police Commander and detectives from the Directorate of Criminal Investigations (DCI) Rarieda, who immediately launched a probe.
A crime scene tape at a past incident. PHOTO KENYANS.CO.KE
At the time the body was discovered, there were clear signs of foul play, with the late officer bearing deep cut wounds consistent with a violent attack.
A TVS motorcycle, believed to have been in his possession at the time of the incident, was found next to the body.
Preliminary investigations revealed that the deceased had earlier escorted a colleague and a third individual. On his way back to a popular shopping centre, the officer's motorbike reportedly ran out of fuel, prompting him to call for assistance.
The colleague who responded to the distress call arrived at the scene only to find the officer dead, with fatal head wounds.
The body has since been moved to Lwak Mission Hospital Mortuary, pending a postmortem examination to determine the exact cause of death.
Incidents of homicides where law enforcers are the victims have risen in recent months, with the Rarieda ordeal coming just weeks after suspected thugs shot an officer dead in Thika.
The officer, who was in plain clothes, is believed to have been shot after a routine inspection of motorcycles turned violent.
A separate incident in June also saw a police officer in Nakuru County killed, while two others were wounded after an ambush by an armed gang while on patrol on Sunday night.
Police vehicles at former Interior Cabinet Secretary Fred Matiang'i's home in Karen on Wednesday, February 15, 2023. CITIZEN TV",https://www.kenyans.co.ke/news/114280-police-officer-found-dead-roadside-siaya
MP Ranked The Most Influential Youth African Leader,"Embakasi East Member of Parliament Babu Owino has been ranked as the Top Influential Youth African Leader of the Year at the 2025 Africa Golden Award held in Lagos.
The African Golden Award stated that the award highlighted Owino's strong voice in youth empowerment and his leadership across the continent.
It also praised Babu for showing that young leaders can shake up politics and speak truth to power.
“A leadership journey for the history Book. Kenya’s firebrand politicians and youth empowerment champion Babu Owino, has been celebrated as Top influential Young Leader at the 2025 African Golden Awards, a testament to his fearless advocacy,” African Golden Awards stated.
Embakasi East Member of Parliament Babu Owino during protests in the Nairobi CBD on Wednesday, June 25, 2025. PHOTO BABU OWINO
The MP became prominent as a student leader at the University of Nairobi, where he served as chairman of the Students Organisation of Nairobi University(SONU).
He earned a first-class degree in Actuarial Science, then studied law, and currently he holds two master's degrees.
In 2017, Babu Owino became the youngest MP at the age of 29 when he was elected Embakasi East MP on an ODM ticket.
According to the African Golden Award, Babu Owino built programmes for the needy that supports more than 50,000 Africans.
It added that he is recognised both internationally and locally. In early 2025, the MP was ranked by Infotrack, a research firm, as the best performing MP in Kenya.
Infortrack revealed that he had a 72 per cent approval rating based on a survey involved at least 40,000 respondents across all 47 counties.
He has also since been recognised by Politrack Africa as the best MP in Kenya in their 2025 Star Leaders Awards.
The African Golden Award stated that the MP's mix of activism, education, and political influence on the citizens made him rank the top leader across the continent.
Embakasi East Member of Parliament Babu Owino during a past event on January 5, 2025. PHOTO BABU OWINO",https://www.kenyans.co.ke/news/114279-mp-babu-owino-ranked-most-influential-youth-leader-africa-golden-awards
"Govt Official, Police Summoned Over Missing CCTV in Likoni Ferry Tragedy","Three top officials, including a Managing Director have been summoned by a Mombasa court for questioning over the handling of CCTV footage tied to the 2019 Likoni Ferry tragedy.
On Thursday, July 17, Mombasa Law Courts Chief Magistrate Alex Ithuku directed Kenya Ferry Services(KFS) boss, the Likoni Sub-county Directorate of Criminal Investigations (DCI) head, and a senior investigating officer to appear in court on July 24, 2025.
The directive came amid mounting concerns over missing or incomplete video evidence which had the potential to shed more light on the 2019 incident which saw 35-year-old Mariam Kighenda and her 4-year-old daughter drown after their car plunged into the Indian Ocean.
At the time, rescuers took 13 days to retrieve the bodies of mother and daughter who were found in a tight embrace, in an incident which caused nationwide outrage.
A trailer plunged into the Indian Ocean at the Likoni crossing channel on Wednesday, January 13 FILE
Principal Prosecution Counsel Alex Ndiema asked the chief magistrate to compel the officials to explain the chain of custody for the CCTV footage.
This is amid allegations that the footage was handed to KFS management instead of being properly submitted as official evidence.
While the investigating officer presented a short clip showing the vehicle slipping into the Indian Ocean during the hearing, the video was ruled incomplete since it failed to show the whole events which led to the plunge.
Due to the gap in evidence, the judge expressed concern about the legality and thoroughness of the investigation. Further, the court noted that the original, unedited footage was never availed, raising suspicion about how the case was being handled.
The court also heard that a former lead investigator in the case bypassed formal protocols by turning over the raw footage believed to contain the whole sequence of events, to KFS management.
According to the Office of the Director of Public Prosecutions (ODPP), the missing footage is now being considered a key piece of evidence in determining whether the tragedy was as a result of negligence or lapses in procedure.
In the years since the tragedy, fresh evidence has emerged, with two officials from the KFS admitting in 2022 that the ferry that claimed the lives of Kaghenda and her daughter was faulty.
An engineer with KFS told Mombasa Chief Magistrate Martha Mutuku in 2022 that all blame fell on the faulty prow that failed to provide sufficient buoyancy for the ferry.
A ship passing through the Likoni Floating Bridge FILE",https://www.kenyans.co.ke/news/114278-court-summons-kfs-boss-police-over-missing-cctv-footage-2019-likoni-ferry-tragedy
CS Mbadi Warns IEBC Over Election Budget,"Treasury Cabinet Secretary John Mbadi has warned the Independent Electoral and Boundaries Commission (IEBC) against reckless spending of its budget ahead of the upcoming planned by-elections.
While speaking before a Parliamentary committee on Thursday, July 17, Mbadi urged the Commission to utilise its budget amounting to billions of shillings, wisely, ahead of the over 20 pending by-elections and upcoming 2027 General Elections.
CS Mbadi revealed that oversight would be conducted on the IEBC over the use of its budget, warning that dire consequences awaited the electoral body if investigations revealed misappropriation of the funds.
“Even IEBC, we are going to ask questions. They are things that you buy and do not dispose of immediately. Why do you buy them in every election cycle?” Mbadi posited regarding the procurement of biometric kits.
New Independent Electoral and Boundaries Commission (IEBC) Chairperson Erastus Ethekon during his swearing-in at the Supreme Court buildings on Friday, July 11, 2025. PHOTO JUDICIARY
“Even ballot boxes, these things, even if they look a bit old, who is fighting with them? Why must they be bought every election? A lot of savings can be realised,” he added.
In February, the IEBC Deputy Chief Executive Officer (CEO), Obadiah Keitany revealed that Ksh61 billion would be needed to finance the upcoming 2027 General Elections.  
Appearing before a National Assembly Committee, Keitany confirmed the figure, adding that the commission would register an additional 5.7 million Kenyans as voters. This would bring the total figure of registered voters to 28 million.
The money would be used for a variety of activities, ranging from boundary delimitation, kit replacement, allowances, ballot paper transport, and other miscellaneous costs.
For boundary delimitation, Keitany informed the committee that the Commission’s budget was Ksh7 billion but this was still a matter that needed advice from the courts. 
At the time, the Commission added that 14 by-elections were still pending, with a projected cost of Ksh480 million needed to conduct the mini-polls.
IEBC Finance Director Osman Ibrahim also stated that 45,352 Kenya Integrated Election Management System (KIEMS) kits, which IEBC needs to electronically capture voters’ facial images, fingerprints, and civil data, would need replacing.
Even as he assured that his ministry would disburse adequate funds on time, Mbadi noted that the operational costs were still too high and called for austerity in the electoral body’s operations.
He added that the government would ensure that elections are conducted on time, assuring that all the necessary support would be given to the IEBC. 
“We will run our elections in 2027 within the time required, and I do not think there will be any hitch,” he stated.
The IEBC team at the Bomas of Kenya during the tallying of the 2022 general elections. PHOTO VOA",https://www.kenyans.co.ke/news/114277-cs-mbadi-warns-iebc-against-extravagant-spending-during-elections
State Gives Update on 70KM Road Construction Within Nairobi,"President William Ruto has revealed that the government is in the process of establishing a 70-kilometre road network across Nairobi.
Speaking in Embakasi on Thursday, July 17, the head of State claimed that the roads will be essential in easing traffic across the city, which will in turn catalyse economic metamorphosis within the country's capital.
According to the president, the project, which is being executed in phases, is part of the government's strategy to also see the modernization of the city and position it as a prominent global hub.
""We have rolled out a comprehensive plan that will change the face of Nairobi to make it a top global hub,"" Ruto said.
President William Ruto, alongside Nairobi Governor Johnson Sakaja and other officials, inspected a project plan in Nairobi on Thursday, July 17. PCS WILLIAM RUTO
""In the first phase, we are constructing at least 70 kilometres of roads within the city to facilitate trade, ease traffic, and spur growth,"" he added.
Furthermore, the president said that the government is in the process of rehabilitating several key roads that are damaged to enhance mobility in the city.
The announcement by Ruto comes two days after the Kenyan National Highways Authority (KeNHA) revealed that it is in the process of expanding Kiambu Road from a two-lane single carriageway to a four-lane dual carriageway in a bid to ease traffic at the busy road.
In a notice on Tuesday, July 15, the Authority said that it has received a Ksh38.7 billion loan from the China Export-Import (EXIM) Bank , which will facilitate the expansion of the road.
According to KeNHA, the road will be expanded from  Pangani Estate in Nairobi County through Muthaiga and then end at Ndumberi in Kiambu County.
According to KeNHA, the highway will include two-lane service roads on both sides and pedestrian walkways along the entire route, as well as new bridges.
""The Government of Kenya has received commitment from China through the China Export Import Bank to finance the cost of the Capacity Enhancement of Pangani–Muthaig –Kiambu–Ndumberi (B32) Road,""  the notice stated.
""The project will be implemented through FIDIC Silver Book – Engineering, Procurement and Construction Contract Arrangements,""  it added.
A traffic snarl up along Kiambu Road on Sunday, September 2, 2021. KENYANS.CO.KE",https://www.kenyans.co.ke/news/114276-govt-unveils-70km-nairobi-road-project-ease-traffic-boost-growth
Protests Erupt Over Shooting of Security Guard,"Private security guards in Nairobi staged a protest on Thursday, July 17, demanding justice after their colleague was tragically shot and killed while on duty. The incident occurred during the volatile nationwide protests on June 25.
The guards gathered en masse at the property where Fred Wamale was shot.
Wamale was shot at about 4:30 pm on June 25, while positioned at the entrance of the company's building. His employer confirmed the fatal shooting occurred as he performed his duties amidst widespread demonstrations on that day.
The protesting guards insisted on a thorough investigation into Wamale's death and expressed fears for their own safety in similar future situations.
Police officers in Nairobi CBD during the June 25 protests, June 25, 2025. KENYANS.CO.KE JAPHETH KAIMENYI
This latest incident highlights the precarious position of private security guards, who often find themselves on the front lines during protests with limited defensive capabilities. 
The incident came on a day marked by renewed protests nationwide as thousands took to the streets in remembrance of the deadly June 25, 2024, anti-finance bill demonstrations.
In a statement released on June 25, Wamale's host company extended condolences to his family and colleagues as they confirmed that he was shot at the entrance of their office building.
""We are deeply saddened to report that Mr Fred Wamale, a security guard stationed at our headquarters, was fatally shot at the entrance of the building at 4:30 pm this evening during the ongoing protest,"" they said. 
Wamale was rushed to Mama Lucy Kibaki Hospital but was sadly pronounced dead upon arrival in the hospital.
The family of Wamale, led by his widow, Merceline Otieno Kesa, also demanded justice and transparency.
A post-mortem was done, and it was confirmed that the bullet entered his abdomen and pierced his spine.
The colleagues and family said that they deserve clear answers, demanding individuals involved in the shootings be arrested.
Police manning protesters in Nairobi CBD, June 25, 2025. KENYANS.CO.KE JAPHETH KAIMENYI",https://www.kenyans.co.ke/news/114275-security-guards-protest-colleagues-shooting-during-june-25-demos
