headline,description,url
National Treasury Officials Busted in KSh10 Million Bribery Scam,"Four employees at the National Treasury Pensions Department have found themselves in trouble with the law after being implicated in a bribery syndicate targeting members of the public.
The Ethics and Anti-Corruption Commission (EACC) confirmed the arrests on Thursday, July 17, following a two-month undercover operation by the commission.
According to the EACC, the operation was triggered by numerous complaints from members of the public, who reported facing frustration from the Pensions Department whenever they sought services.
Preliminary investigations uncovered a well-coordinated criminal network within the department, where officers are alleged to have engaged in extorting bribes from the public in exchange for faster services.
A section of the EACC headquarters, Integrity Centre in Nairobi County PHOTO EACC
Among the suspects under investigation are two senior pension officers, a chief clerical officer, and an intern.
The EACC further revealed that members of the public were reportedly required to pay money through a mobile money paybill account in exchange for the expedited processing of their requests.
Investigations revealed that a total of Ksh10.5 million had been transacted through the paybill, which was registered under the name of the intern’s mother.
""In the last two years, a total of Kes10,523,044 has been transacted through the paybill account, with the above suspects receiving various amounts. Further investigation reveals that the said paybill account is registered in the name of Mr Muhando's mother,"" the EACC revealed in its report.
The four suspects have since been processed at the Integrity Centre Police Station and are expected to be transferred to Kilimani Police Station pending further investigations.
This is the latest case of the EACC cracking down on malpractice within a government institution, with the new tactic involving sting operations seemingly paying dividends. In April, two officials from the Kakamega Civil Registration Department were arrested for allegedly soliciting and receiving bribes from applicants seeking civil registration documents.
Like the National Treasury suspects, the duo, a Civil Registrar stationed at the Kakamega Huduma Centre and a Civil Registration Officer, are alleged to have solicited bribes to speed up service delivery.
A separate incident in March saw EACC officials catch a government official working with the Lands Control Board red-handed, receiving a Ksh70,000 bribe.
A man with handcuffs PHOTO FILE",https://www.kenyans.co.ke/news/114292-eacc-uncovers-bribery-ring-national-treasurys-pensions-office
AU Addresses Summit Targeting Youth for Ambassadorial Roles,"The African Union Commission (AUC) has issued a public warning disowning an event allegedly aimed at recruiting young Africans for ambassadorial roles.
In a statement released through its Department of Education, Science, Technology and Innovation, the AUC clarified that the summit and its associated Country Ambassador application form were illegitimate.
The Commission further stated that no such application was developed, approved, or disseminated through any of the AUC’s official websites or social media platforms.
""The African Union Commission categorically states that it has not organised the purported Summit and neither has this form, the website, and their contents been developed, approved, or disseminated by the  African Union,"" AUC's statement read.
Notably, AUC's warning came after a number of professionals and students reported coming across online advertisements inviting them to apply for ""Country ambassador"" roles for the 'summit'.
Former first lady Margret Kenyatta during a past African Union summit. PCS
The flagged application form entices unsuspecting users with a lead question that states, “Do you have what it takes to represent the AU Strategic Objectives (CESA AU 25–34) in your country?”
It goes on to state that selected ambassadors would be tasked with promoting the AU's 12 strategic objectives, engaging stakeholders, mobilising schools, and helping to plan the summit.
The same form promises several benefits to successful applicants, including an official certificate of appointment, a continental ambassador recognition certificate (upon meeting targets), and the opportunity to attend the summit fully sponsored, including air tickets and accommodation.
The post further alleged that the summit would be held annually in different African cities over the next decade, while promising ambassadorships to individuals who achieve their set goals.
However, the AU dismissed the claims, advising stakeholders in Kenya and across Africa to avoid interactions with the unauthorised platform, which requires one to share personal details.
""We advise all stakeholders, including youth, educators, and prospective applicants, to exercise extreme caution and refrain from sharing personal information or engaging with unauthorised platforms misrepresenting themselves as being associated with the African Union,"" the statement went on. 
AU, while distancing itself from the event, also warned that unauthorised use of its name, logo, or any references to its staff constituted a violation of its intellectual property and institutional integrity.
African Union Chairperson Mahmoud Youssouf during a past interview. PHOTO NTV",https://www.kenyans.co.ke/news/114291-african-union-flags-fake-summit-targeting-young-kenyans-ambassadorial-roles
Another Patient Killed Inside KNH Ward,"Another patient has reportedly been killed at the Kenyatta National Hospital (KNH), raising fresh concerns about patient safety at the country’s largest referral hospital.
According to reports from the authorities, the 52-year-old male patient was found dead on his bed in Ward Seven. Witnesses stated that the patient was physically disabled.
Security agencies, led by the Directorate of Criminal Investigations (DCI), have camped at the hospital to determine what exactly transpired and who was responsible for the patient’s death.
In a statement issued hours after the incident, KNH CEO William Sigilai confirmed on Thursday, June 17, that the patient was found dead after visiting hours, at around 2 pm.
A hospital ward in Kenya. PHOTO KENYANS.CO.KE/MURANG'A GH
""We are deeply saddened to confirm an incident regarding the tragic death of a patient at Kenyatta National Hospital. On the afternoon of July 17, 2025, at around 2 pm, immediately after visiting hours, a patient was discovered in a medical ward in blood-soaked beddings. The patient was examined and certified dead,"" the CEO stated.
""The matter has since been reported to the Directorate of Criminal Investigations (DCI) and other government security agencies. Our thoughts and prayers are with the patient's family during this difficult time,"" he added.
While extending its condolences to the family, the hospital assured Kenyans of its commitment to safety and stated that it would provide updates as more information became available. about the incident
The incident marks the second time this year that a patient has been murdered at the hospital under unclear circumstances.
In February, another patient was found murdered inside the hospital after being fatally stabbed by an unknown individual on the night of Thursday, February 6.
Initial reports blamed the incident on a security lapse, claiming that an unidentified individual entered Ward Seven and fatally stabbed the patient with a kitchen knife.
""We are deeply saddened to confirm an incident involving the tragic death of a patient at the Kenyatta National Hospital,"" the CEO said.
""The hospital is working closely with law enforcement authorities and has launched an internal investigation to determine the facts surrounding this incident,"" he added.
Kenyatta National Hospital Emergency Wing entrance. PHOTO KNH",https://www.kenyans.co.ke/news/114290-another-patient-killed-inside-knh-ward
Police Commission Breaks Silence on Alleged Rift With IG Kanja,"The National Police Service Commission (NPSC) has denied claims of a rift with the National Police Service (NPS) regarding the management of human resource functions.
In a statement on Thursday, July 17, the NPSC clarified that the purported standoff was based on misunderstandings linked to past audit queries and not the current state of affairs within the police service.
According to the NPSC, the issues predate September 2024, when Douglas Kanja began his tenure as Inspector General of Police.
""The Commission wishes to clarify that the audit matters under discussion pertain to the financial year 2022/2023, which was prior to the appointment of the current Inspector General of Police, Mr Douglas Kanja,"" a statement from the NPSC said.
NPSC CEO Peter Leley appearing in Parliament, July 16, 2025. PHOTO NPS
The clarification came after the NPSC appeared before the Parliamentary Public Accounts Committee (PAC) to respond to concerns raised by the Office of the Auditor-General regarding financial accounts for the year ending June 30, 2023.
Speaking during a session with the National Assembly’s Public Accounts Committee on Wednesday, July 16, NPSC CEO Peter Leley told the committee that the Commission had been unable to audit the police payroll, raising accountability concerns about whether its decisions on recruitment and staffing had been implemented.
“We are static in accessing the payroll for purposes of auditing, the payroll to ascertain whether the decision of the commission have been complied with,” Leley said.
However, in their statement, the NPSC emphasised that since Kanja took office, there has been a “cordial and collaborative working relationship” with the Commission, enabling the seamless execution of each agency's constitutional mandate.
“There has not been any strained relationship with the Service under Mr Kanja’s stewardship,” the statement added.
Incidentally, the commission's response came barely 24 hours after media reports suggesting that IG Kanja had blocked access to the police payroll, effectively hampering audit efforts by the NPSC.
Further reports indicated that the commission raised concerns with parliament, raising alarm over obstruction and lack of cooperation from the NPS in reviewing salary-related documents. These claims fuelled speculation of underlying friction between the NPS and NPSC.
These claims have since been refuted by the NPSC, who insist the alleged 'turf war' between the two agencies did not reflect the current reality. 
Inspector General of Police Douglas Kanja wearing the AFRIPOL lapel pin during a meeting with members from the Law Society of Kenya at his Jogoo House office, June 4, 2025. PHOTO NPS",https://www.kenyans.co.ke/news/114287-police-commission-denies-rift-ig-kanja-affirms-support-police-reforms
Kenyan Marathon World Record Holder Suspended,"The Athletics Integrity Unit (AIU) has provisionally suspended marathon record holder Ruth Chepng'etich after she tested positive for prohibited substances.
In a statement on Thursday, July 17, the AIU stated that samples collected on March 14 showed the presence of Hydrochlorothiazide (HCTZ).
According to AIU Head Brett Clothier, Chepng'etich was later notified of the results and interviewed in person by the unit on April 16, where she complied with requests regarding the investigation.
Clothier added that three days after the interview, on April 19, Chepng'etich voluntarily opted for the provisional suspension while investigations into her case were ongoing.
Women's marathon record holder Ruth Chepngetich. PHOTO/ Kenyans.co.ke
""A Notice of Charge has been issued against Chepng’etich regarding the detection of the Prohibited Substance – a diuretic – following an investigation into the Kenyan athlete’s positive test, which was reported to the AIU on 3 April this year, at an estimated concentration of 3800 ng/mL in urine,"" the AIU stated.
""Presenting a brief chronology of this case, AIU Head Brett Clothier revealed Chepng’etich was 'notified and interviewed in person by the AIU in Kenya on 16 April and complied with requests regarding our investigation',"" it added.
According to the AIU, the athlete has the right to have her case heard before a disciplinary tribunal.
The suspension comes 10 months after the 30-year-old made history by winning in a world record time of 2:09:57 at the Chicago Marathon in October last year.
Chepng’etich, who won the Chicago Marathon for the third consecutive time, broke the previous world record of 2:11:53, which had been set by Ethiopian Tigst Assefa at the 2023 Berlin Marathon.
""I feel so great. I am very proud of myself and I've done well for the victory and the world record,"" Chepng’etich said after her win.
""This is my dream that has come true. I fight a lot thinking about the world record. I am very grateful,"" she added.
The suspension comes just three months after AIU also confirmed a two-year ban on Kenyan marathoner Purity Changwony after she tested positive for two banned substances, Norandrosterone and Triamcinolone Acetonide.
Runners embark on the Hangzhou Marathon. PHOTO/ hangzhou.com.cn",https://www.kenyans.co.ke/news/114288-chicago-marathon-champion-ruth-chepngetich-provisionally-suspended-doping
Police Intercept Suspect With Truckload of Stolen SGR Equipment,"Police have apprehended a suspect who is said to have been transporting stolen Standard Gauge Railway (SGR) railway materials in Kibini area, Kajiado County, using a lorry.
In a statement on Thursday, July 17, the National Police Service (NPS) confirmed that the suspect was intercepted following a tip-off.
The railway materials included 61 railway sleepers and 60 rail bars, according to the officers. The operation was spearheaded by officers from the Critical Infrastructure Protection Unit (CIPU) and police from the Sultam Hamud Police post.
""Today, 17 July 2025 – Officers from the Critical Infrastructure Protection Unit (CIPU), working collaboratively with colleagues from the Sultan Hamud Police Post, acted on a tip-off and intercepted a lorry suspected of transporting stolen railway materials in the Kibini area,"" NPS stated.
A lorry under custody for ferrying stolen railway construction materials PHOTO NPS
""Upon inspection at Sultan Hamud Police Post, the vehicle was found to be carrying 61 railway sleepers and 60 rail bars, suspected to have been vandalised from the railway line,"" It added.
The National Police Service (NPS) has confirmed that security agencies have launched investigations into the matter, and the suspect is awaiting arraignment in court.
""NPS commends the officers for their swift action and reiterates its commitment to protecting critical infrastructure and bringing vandals to justice,"" it stated.
In Kenya, any person caught vandalising railway infrastructure is guilty of a felony and is liable to imprisonment for life.
In a statement issued in December 2024, the Kenya Railways Corporation cautioned Kenyans against vandalising railway infrastructure, stressing that such actions pose a great risk to passengers.
The Corporation urged members of the public to remain vigilant and report cases of vandalism to law enforcement immediately.
""We wish to notify the public that vandalism of railway property is a crime punishable by law. The safety of our passengers is of paramount importance to us,” Kenya Railways said.
During his time as the Interior Cabinet Secretary, Deputy President Kithure Kindiki announced that acts of vandalism of railway infrastructure would be treated as acts of terror.
Part of the Standard Gauge Railway to the Meter Gauge Railway under construction, Wednesday, February 5, 2025. PHOTO KENYA RAILWAYS",https://www.kenyans.co.ke/news/114283-police-intercept-lorry-ferrying-vandalised-railway-materials-sultan-hamud
MP Livestreams DCI Raid at Her Home Before Arrest,"Naivasha Member of Parliament Jane Kihara has been arrested by the Directorate of Criminal Investigations (DCI) after failing to present herself to detectives following allegations of incitement and undermining a public officer.
In a dramatic event, which she livestreamed on her Facebook account on Thursday, July 17, detectives were seen storming her house in the Maraigushu area and eventually apprehending her.
""Dozens of police officers are currently at my Maraigushu home to arrest me,"" she said in her Facebook account moments before being arrested.
She was taken to Naivasha Police Station to record a statement and later transported to the DCI headquarters on Kiambu Road, Nairobi.
Police Officer at MP Jane Kihara's home in Naivasha on Thursday, July 17. PHOTO JANE KIHARA
Minutes after her arrest, the lawmaker, an ally of former Deputy President Rigathi Gachagua, claimed she was not aware of the charges that led to her apprehension and that the move was politically motivated.
""There is nothing, they are just telling me that I might have investigations that may aid in investigations, which I really don't know what they are talking about, and the information they are seeking,"" she stated.
""The summons is said to have come from Nairobi, and the director is waiting for me there. So we will go there and see what happens,"" she added.
According to a letter issued earlier this week by the Assistant Inspector General of Police, George Lenny Kisaka, the lawmaker was under investigation for disseminating statements that contravened Section 132 of the Penal Code, which criminalises undermining the authority of public officers.
The letter claimed that security agencies have reasons to believe that the lawmaker is directly connected to the alleged offence or possesses crucial information that can aid ongoing investigations.
“I have reasons to believe that you, Hon. Jayne Njeri Wanjiku Kihara, MP Naivasha Constituency, are connected to the offence or have information that can assist me in my investigations,” the letter read.
Kihara had been ordered to present herself before officers at the DCI Headquarters, on Kiambu Road, on Monday, July 14, 2025, at 10:30 am. The notice cautioned that she would be liable to prosecution if she failed to present herself on the stipulated date. 
Responding to the letter, Kihara accused the government of using state agencies to intimidate and silence critics. 
“The days of intimidating leaders using the criminal justice system are long gone. Summoning me to DCI headquarters tomorrow will not change Kenyans’ resolve because it’s not about Jayne Kihara but about our country, Kenya,” Kihara said.
Naivasha MP Jayne Kihara addressing residents at a past event, June 29, 2025. PHOTO JAYNE KIHARA",https://www.kenyans.co.ke/news/114285-naivasha-mp-jayne-kihara-arrested
Trailblazing Kenyan Feminist & MP Phoebe Asiyo Dies at 92,"Kenya has been plunged into mourning after the death of Phoebe Muga Asiyo, the pioneer of the Maendeleo ya Wanawake movement.
Asiyo's passing was confirmed by her family in a statement, which revealed that the icon had passed away peacefully in her sleep while in North Carolina, U.S.
“With heavy hearts, the Asiyo family shares the profound loss of our cherished mother, Hon. Dr. Phoebe Muga Asiyo… Her presence and love will be deeply missed by all who knew her,” the family statement read in part.
A bold advocate for women’s rights, Asiyo became a Member of Parliament for Karachuonyo in 1982, becoming one of the few women in Kenyan history to achieve such a feat at the time.
A young Phoebe Asiyo , the pioneer of the Mandeleo ya Wanawake movement. PHOTO PHOEBE ASIYO
She is largely remembered as the original voice behind the push for gender equality laws, more specifically, the two-thirds gender principle, which was eventually incorporated into the 2010 constitution.
Long before women's rights went mainstream, Asiyo was already vocal in championing fair representation and the inclusion of women in leadership positions.
Her advocacy journey is intertwined with the oldest and most influential women's organisation, Maendeleo ya Wanawake, where she held key leadership roles in the group, which served as a platform for nurturing women leaders.
Through Maendeleo ya Wanawake, Asiyo used her growing influence in the group to lay the foundation for various women's movements in the country.
Away from Parliament,  Asiyo served as Kenya’s representative to the United Nations Commission on the Status of Women and was heavily involved in international conversations around gender equality, peace, and development.
Because of her push for Kenyan women's rights, her voice carried the message across borders, further elevating Kenya's profile on issues affecting women.
In her twilight years, Asiyo was a key voice in national reconciliation and peace-building efforts, especially during and after Kenya’s political transitions, which have been tense in recent elections. 
Among the first leaders to mourn Asiyo was Homa Bay governor Gladys Wanga, who described the late Asiyo as a beacon and 'mentor to many'. 
""Mama Phoebe Asiyo was not just a leader; she was the steady hand that lifted others, the voice that spoke for the voiceless, and the unwavering spirit that refused to accept injustice,"" Governor Wanga stated. 
A collage of Maendeleo ya Wanawake founding chairperson Phoebe Asiyo. PHOTO KENYA NEWS",https://www.kenyans.co.ke/news/114284-former-karachuonyo-mp-phoebe-asiyo-dies-92
