headline,description,url
Malala Reveals When Gachagua's DCP Party Will Be Launched,"The Democracy for Citizens Party (DCP) Deputy Party Leader, Cleophas Malala, has revealed that the much-anticipated party launch will be held immediately after the party leader, Rigathi Gachagua, returns from his trip to the United States.
Speaking to Standard Digital on Thursday, July 17, the former Kakamega Senator said that the party launch would be held in about three months.
“We were waiting for the political temperatures to calm down, but immediately our party leader comes back from the US, DCP will be finally launched. Within three months, we will have launched our party,” Malala said.
However, Malala failed to reveal the venue or the tentative date, claiming that further details on the launch would be unveiled soon.
Former Deputy President Rigathi Gachagua at a past event donning his new party colours PHOTO DCP PARTY
In a subsequent press briefing, Malala and other DCP officials confirmed that the party would be fielding candidates in the upcoming by-elections across the country.
This comes weeks after its highly anticipated launch on June 3 was postponed after the party was denied access to Kasarani Stadium, where it had planned to hold its national launch.
Gachagua is currently on a two-month trip to the US, where he is on a mission to popularise the party through city hall meetings across several states. The trip is expected to end in August.
Malala further explained that he had been left out of the US trip so that he could hold the fort back in the country to ensure party activities continued to run smoothly.
Since announcing the party on May 15, DCP has faced a series of unfortunate events regarding its launch, which Gachagua had announced would be open to all Kenyans.
Originally, it had been slated for June 3 at Kasarani Stadium, but the party’s Nairobi Patron, Irungu Nyakera, announced its cancellation just a day before the launch.
""The DCP party launch that was to be held on Thika Road has been called off, awaiting a new venue and date,"" Nyakera stated on June 2.
While speaking during an engagement with the Maa community on June 23, Gachagua claimed that he would be launching the party on July 7 in Maa land if they were to provide a private space, citing the likelihood of goons being sent to disrupt the event.
“I wanted to have the party launch in Nairobi, but they declined,"" Gachagua said. “I want to ask you, if you will allow, to allow the event to take place in Maa land.”
The party’s deputy leader confirmed this assertion during a TV interview, but it would not come to pass, as the day coincided with the eventful Saba Saba protests that left at least 38 dead.
This came just days after posters circulated online claiming that the party would be launching during the June 25 commemorative protests. The party later dismissed the claims as fake.
Rigathi Gachagua and other DCP Party officials during their unveiling on May 16, 2025.",https://www.kenyans.co.ke/news/114274-dcp-party-launch-within-3-months-malala-confirms
Ruto’s Advisor Wants Boda Bodas Banned from All Major Towns,"President William Ruto's Senior Advisor on Constitutional Affairs, Makau Mutua, has called for the complete removal of boda bodas from all major cities and towns across the country.
In a statement issued on Thursday, July 17, Mutua has described the presence of boda bodas in all major cities and towns as the main source of chaos within these cities.
He further alleged that these boda bodas destroy the aesthetics of the cities and towns, terming it necessary to have them removed.
''I am convinced that ALL boda boda should be banned from the streets of ALL Kenya’s major cities and towns.  No modern city should tolerate such chaos, illegality, terrible aesthetics, and indiscipline on its roads.  Absolutely Unacceptable,'' Mutua alleged.
President William Ruto with long-time ally of Raila Odinga, Prof Makau Mutua, at State House, Nairobi, April 30, 2025. PCS
Boda bodas are the most popular form of transport in the country, especially in cities like Nairobi, Mombasa, Kisumu, and Eldoret. They offer fast, affordable transport and are often the only option in congested or underserved areas.
However, they have numerously been linked to rising cases of road accidents, crime, and traffic violations.
Mutua's sentiments elicited a heated debate among a section of Kenyans. In response to his sentiments, some Kenyans agreed with the advisor's opinions while others strongly disagreed.
This is not the first time a senior leader has called for the regulation of boda bodas on the roads in the country. In May, Central Organisation of Trade Unions (COTU) Secretary General Francis Atwoli made similar calls.
Speaking during the Labor Day celebrations, Atwoli called for the regulation of the boda bodas; however, his main focus was on Nairobi City, with an additional focus on hawkers and matatus.
According to Atwoli, boda bodas, matatus and hawkers in the city depicted the county and country at large as poor.
''This city must reflect other cities of the world like Accra, Abuja, Abidjan, and Kigali. We cannot remain in a filthy city, a city filled with hawkers, riders, and matatus. When somebody arrives at the JKIA airport on Mombasa Road is full of hawkers, depicting the picture of the poverty of Kenya,"" Atwoli said.
Meanwhile, boda bodas have remained a lifeline for many Kenyan youths who use it as a form of self-employment to earn an income.
A photo of boda boda riders waiting for clients in Nairobi, June 16, 2023 PHOTO BODABODA SAFETY ASSOCIATION OF KENYA",https://www.kenyans.co.ke/news/114272-makau-mutua-says-boda-bodas-should-be-banned-major-cities-and-towns
Govt Unveils Special Loans for Select Students,"The government has unveiled a targeted student loan programme aimed specifically at students pursuing forestry studies.
The new loan facility was announced on Thursday, July 17, following the signing of a service contract between the Kenya Forest Service (KFS) and the Higher Education Loans Board (HELB) to establish the Kenya Forestry College Student Funding Scheme (KFC-SF).
Signed at the KFS headquarters in Karura, the Kenya Forestry College Student Funding Scheme (KFC-SF) seeks to offer tailored financial assistance to students enrolled in forestry-related courses at the Kenya Forestry College (KFC) through loans and bursaries.
Clement Ng’oriareng of KFS and HELB CEO Geoffrey Monari formalised the agreement on Thursday, with Ng’oriareng describing the contract as a critical step towards building a workforce that can support Kenya's forestry and environmental protection goals.
Officers outside the Kenya Forest Service (KFS) gate when it was opened in 2011 KFS
He also emphasised the growing demand for green careers and the need for the country to invest in talent capable of managing Kenya's natural resources in a sustainable way.
While the scheme will be fully administered by HELB, it will be subject to strategic oversight from a tripartite committee comprising members from KFS, HELB, and the Kenya Forestry College.
This structure, according to the KFS, is a deliberate design to ensure that funding is efficient and aligns with the government's forestry goals.
Kenyan universities have introduced a range of forestry-related academic programmes as the push for environmental conservation gains momentum globally.
One of the most common programmes is a Bachelor of Science in Forestry, which covers key areas such as forest ecology, silviculture, forest management, and forest policy.
A Bachelor of Science in Agroforestry and Rural Development is another popular course, focusing on integrating trees into farming systems and supporting sustainable livelihoods.
The new partnership comes at a time when HELB was grappling with financial challenges, with CEO Charles Ringera confirming a significant financial shortfall for student loans this year.
HELB reportedly received Ksh26 billion for the 2025/2026 financial year, far short of the Ksh48 billion the board says is needed to provide loans to students from low-income households pursuing higher education.
People waiting to be served at the HELB offices in Nairobi. PHOTO BD",https://www.kenyans.co.ke/news/114273-govt-fund-forestry-students-under-new-kfs-helb-deal
Inside Structure of the IEBC and Why it Matters in Elections,"A central pillar of Kenya's democracy, the Independent Electoral and Boundaries Commission (IEBC) is a body often misunderstood yet perpetually under the microscope. Tasked with the monumental responsibility of delivering free, fair, and credible elections, its structure, processes, and independence are under constant scrutiny. But what exactly is its anatomy, how is it designed to navigate the complexities of electoral management, and what are the crucial tasks that define its mission?
The IEBC's very genesis lies in a painful chapter of Kenya's history. Established on November 9, 2011, through the provisions of the 2010 Constitution (Article 88) and the IEBC Act, 2011, it emerged from the ashes of past electoral controversies. It specifically replaced the Interim Independent Electoral Commission (IIEC), which itself was a transitional body formed after the widespread dissatisfaction and violence that followed the disputed 2007 General Election. The formation of the IEBC was, therefore, a cornerstone reform, designed to instill independence and restore public confidence in Kenya's electoral processes.
At its core, the IEBC's mandate is comprehensive, spanning the entire electoral cycle. From the initial stages of voter registration to the final tallying of results, the Commission is constitutionally empowered to oversee every aspect. Its key functions include the continuous registration of voters, the critical task of delimiting electoral boundaries, regulating the intricate affairs of political parties, settling pre-election disputes, and meticulously registering candidates vying for various elective offices. 
Beyond the mechanics of voting, the IEBC is also charged with public voter education, facilitating election observation, enforcing campaign finance regulations, and upholding a robust electoral code of conduct.
New Independent Electoral and Boundaries Commission (IEBC) Chairperson Erastus Ethekon during his swearing-in at the Supreme Court buildings on Friday, July 11, 2025. PHOTO JUDICIARY
The decision-making and oversight body of the IEBC comprises a Chairperson and six Commissioners. These individuals are selected through a rigorous, public recruitment process conducted by an independent IEBC Selection Panel, ensuring a degree of transparency in their appointment. The current team is led by Chairperson Erastus Ethekon, who recently took over the mantle, inheriting a role previously held by figures like the late Wafula Chebukati, whose tenure was marked by immense pressure and significant legal battles.
Chairperson Ethekon, alongside Commissioners Ann Njeri Nderitu, Moses Alutalala Mukhwana, Mary Karen Sorobit, Hassan Noor Hassan, Francis Odhiambo Aduol, and Fahima Araphat Abdallah, were sworn into office recently. Their non-renewable six-year term immediately thrust them into the heart of Kenya's political landscape, with their most immediate and significant challenge being the oversight of the upcoming 2027 General Election.
This reality was not lost on Ethekon, whose first words after his swearing-in underscored his commitment: ""My first loyalty is to Kenyans,"" he affirmed, pledging to ensure a peaceful and credible electoral process.
Critical to the delivery of fair elections are two particularly complex and often contentious functions: voter registration and electoral boundary delimitation. The IEBC is responsible for maintaining a clean and accurate voters' register through continuous registration, as well as periodic cleanups. This ongoing process involves removing deceased voters, correcting erroneous entries, and updating voter details to reflect changes in residence or status, all aimed at safeguarding the principle of ""one person, one vote.""
IEBC & Voter Registration
Voter registration is a multi-faceted process carried out at various gazetted centers across the country. These include permanent IEBC county and constituency offices, temporary registration centers deployed during mass registration drives, and even integrated service points like Huduma Centres. For Kenyans living abroad, the process extends to selected Kenyan missions, ensuring diaspora participation. 
At the heart of this process is the Biometric Voter Registration (BVR) system, which captures an applicant's alphanumeric data alongside unique biometric features such as fingerprints and facial images, which are then used for verification.
Upon successful registration, applicants receive a laminated acknowledgement slip as proof of their entry into the system. This slip, while not a requirement for voting itself, confirms their registration status and the polling station where they are expected to cast their ballot. 
Following any major registration drive, the IEBC publishes a provisional voter register, allowing citizens a crucial period to verify their details online or physically. This verification window also serves as an opportunity for the public to raise objections to any incorrect entries, ensuring the final register used on election day is as accurate and transparent as possible.
An IEBC official coordinates voters at a polling station in the 2013 General Elections. IEBC
IEBC & Boundary Review
Beyond voter registration, the IEBC's mandate includes the intricate and often politically charged process of electoral boundary review, commonly known as delimitation. The core purpose of this exercise is to define or redefine the geographical limits of constituencies, which elect Members of the National Assembly, and county assembly wards, which elect Members of County Assemblies. This function is vital for ensuring equitable representation across the diverse regions of Kenya.
The Constitution provides clear directives for these reviews. Constituencies, currently fixed at 290, must be reviewed at intervals of not less than eight years and not more than twelve years. The last delimitation was done in 2012.
Crucially, any changes must be completed and gazetted at least twelve months before a general election to prevent disruptions and ensure stability. However, with less than three years remaining until the 2027 polls, the clock is ticking for the IEBC to embark on and conclude any meaningful adjustments to the current boundaries.
The boundary delimitation process relies heavily on the latest enumerated national census figures, such as the 2019 data, which forms the primary basis for determining the ""population quota."" This quota is calculated by dividing Kenya's total population by the fixed number of constituencies (290) or the determined number of wards, providing an average population size for each electoral unit. 
While population is key, the Constitution allows for strategic deviations: cities and sparsely populated areas can deviate by up to 40 percent from the average, while other areas are permitted a 30 percent variance.
Beyond numerical quotas, the IEBC considers several qualitative factors during delimitation. These include geographical features like mountains or rivers, the distinction between urban and rural areas, the preservation of ""communities of interest"" (shared cultural, historical, or economic ties), and the existing means of communication and infrastructure. Based on this comprehensive data analysis, the IEBC prepares a preliminary report outlining proposed new names and boundaries, indicating potential mergers, splits, or significant alterations to existing units.
A crucial stage in this process is public participation. The IEBC is constitutionally mandated to notify the public of the review and publish the preliminary report for a minimum of 30 days. During this period, extensive public hearings are conducted nationwide, allowing individuals, community groups, civil society organizations, and political parties to submit memoranda and make oral representations.
Following public input, the IEBC reviews all submissions and makes necessary revisions to its preliminary report within a specified timeframe, typically 14 days. The revised report is then submitted to the relevant Parliamentary Committee for its advisory recommendations. It is important to emphasize that while Parliament offers input, the ultimate and final decision on boundary delimitation rests squarely with the IEBC. 
The final report, detailing the new boundaries, is subsequently published in the Kenya Gazette, though the new boundaries only formally take effect upon the dissolution of Parliament following their gazettment.
Chief Justice Martha Koome flanked by new Independent Electoral and Boundaries Commission (IEBC) Chairperson Erastus Ethekon (left) and Attorney General Dorcas Oduor after the swearing in of the newly reconstituted IEBC team. PHOTO MARTHA KOOME
The IEBC Secretariat
Underpinning the entire operational framework of the IEBC is its professional Secretariat, headed by the Chief Executive Officer (CEO), currently Marjan Hussein Marjan. This administrative and technical arm, comprising nine Directorates, 17 departments, two Deputy Commission Secretaries, and a vast network of County Election Managers (CEMs) and Constituency Election Coordinators (CECs), is the engine that translates the Commissioners' policies into action. 
The Secretariat manages all day-to-day operations, including procurement, logistics, human resources, and the deployment of electoral materials and personnel. During general elections, the CEO serves as the National Returning Officer for the Presidential Election, with CEMs and CECs acting as Returning Officers for their respective regions.
All things considered, the IEBC, through its policy-setting Commissioners and the diligent execution of its Secretariat, is the lynchpin for ensuring that Kenya's elections are conducted professionally, transparently, and credibly, reflecting the will of its people.
IEBC CEO, Marjan Hussein Marjan during a learning session with Malawi Electoral Commission in December 2023 IEBC",https://www.kenyans.co.ke/news/114270-iebc-structure-voter-registration-boundary-limits-unpacking-kenyas-electoral-engine
Ruto Issues Orders to Kanja During Nairobi Tour,"President William Ruto has ordered the immediate withdrawal of police officers stationed at a contested piece of land in Baba Dogo, Nairobi.
Speaking on Thursday during the launch of the Climate WorkX: Rehabilitating the Nairobi River programme, the President directed Inspector General of Police Douglas Kanja and Nairobi Regional Commander George Seda to ensure the officers leave the area without delay.
“I heard there are police officers deployed on that land. I want to direct that they immediately vacate the premises. That land belongs to the public, and this directive should be implemented with immediate effect,” Ruto stated.
The Head of State strongly criticised the unnamed private developer accused of attempting to illegally take over the land, warning that the government would not tolerate such actions.
Inspector General of Police Douglas Kanja (right) with NPS Spokesperson Muchiri Nyaga during a past briefing on May 9, 2025. PHOTO NPS
Further, Ruto promised the residents of the affected area that the government will construct a stadium on the piece of land to help develop local talents and ensure effective utilisation of the property. 
“We will come to construct a stadium on that piece of land,” he said, reiterating the government’s commitment to protecting public property from illegal encroachment.
“To the developer who wants to grab that land, be warned, three things are waiting for you. Stop immediately or prepare to face us head-on. This will not be entertained,” the President added.
The ownership of the contested land has been the subject of a dispute, with the developer claiming rightful ownership of the property over the past few months.
On Wednesday, tensions escalated after a standoff broke out between police officers and members of the public. Most of the officers, clad in anti-riot gear, had been deployed to oversee the planned demolition and takeover of the land.
However, hundreds of youth defied orders to vacate and instead remained on the grounds, staging a peaceful resistance.
Videos and images obtained by Kenyans.co.ke showed the youth playing football and engaging in other recreational activities on the pitch, seemingly unfazed by the heavy police presence.
The officers, unable to act due to the defiant crowd, watched from a distance as bulldozers stood by awaiting clearance to begin demolitions.
Despite the heightened tension, no demolition took place, and the operation was halted.
President William Ruto, accompanied by senior leadership of Nairobi county, including Governor Johnson Sakaja and other leaders, during the commissioning of the rehabilitated Bridge Savannah- Stage 17-Masimba Road that traverses Embakasi Central and Embakasi East on July 17, 2025. PCS",https://www.kenyans.co.ke/news/114271-ruto-orders-immediate-police-withdrawal-contested-baba-dogo-land
