original_headline,rewritten_headline,original_description,rewritten_description,image_prompt,image_filepath,url,content_hash,processed_date
Kenya Air Force Plane Crashes,Crash Accidents In Kenya's Air Force Plane,"Two Kenya Air Force officers were on Saturday, June 14, killed in a plane crash in Kwale County.
The officers were killed in Ndavaya, Kinango, in an incident that was confirmed by County Commissioner Stephen Orinde.
Further, the Kenya Defence Forces (KDF) released a statement confirming the incident and also explained the circumstances that seemingly caused the crash.
Despite confirming two officers on board, they neither confirmed nor denied that the crash claimed the lives of the military personnel.
The wreckage of a Kenya Air Force plane that crashed at Ndavaya in Kinango, Kwale County, on Saturday, June 14, 2025 PHOTO JOASH KEMEI
""Earlier today, 14th June 2025, a Kenya Air Force Grob 120A aircraft experienced an emergency while on a training flight in the general area of Mwakijembe Primary School, Ndavaya, Kwale County,' KDF stated.
""On Board were two pilots. Recovery is ongoing,"" added Kenya's military body.
According to flight records, the ill-fated aircraft departed Mombasa at 11:39 am and was last seen near Diani before disappearing from radar. It crashed at approximately 12:06 pm, just 27 minutes after takeoff.
Images obtained by Kenyans.co.ke showed the disintegrated state of the plane's wreckage, with the roof of the aircraft completely undone. 
Out of the cockpit, only the seats remained, with the nose of the plane left with just spare parts. 
Compared with the plane's tail, which had limited damage, the front section was completely damaged, supposedly signalling the plane nose-dived to the ground. 
The scene of the crash was an open field with vegetation, and other reports suggested that it was a common training area for military personnel. Aside from the two officers, no civilian casualties were reported at the time of publishing.
In the aftermath of the incident, curious onlookers started milling around the scene even as emergency response teams were deployed to the crash site to assist in search and recovery operations. 
The wreckage of a Kenya Air Force plane that crashed at Ndavaya in Kinango, Kwale County, on Saturday, June 14, 2025. PHOTO JOASH KEMEI","Two Kenyan Air Force Pilots Mourn a Plane Disaster.  
On Saturday, June 14, 2025, two Kenyan Air Force pilots were killed in a spectacular plane disaster that occurred near Ndavaya, Kinango, in Kwale County. The incident was confirmed by the County Commissioner Stephen Orinde. Despite claiming to have no confirmed or denied lives on board, it was revealed later that neither pilots confirmed nor denied their fatalities.  
The Kenya Defence Forces released a statement about the crash and explained the circumstances, including the plane’s disintegration. images from Kenyans.co.ke showed the disintegrated state of the plane’s wreckage, with only seats remaining in the cockpit and a nose with spare parts. The plane appeared to have hit the ground after diving near the school.  
The scene was noted as an open field, making it a common training area for military personnel. No civilian casualties were reported at the time of publishing.  

[Photo JOASH KEMEI]","[Photo JOASH KEMEI] A serene sunrise over Ndavaya in Kinango, Kwale County, Kenya. The scene is captured with a decomposed plane as the subject, surrounded by surrounding nature. Two Kenyan Air Force pilots face each other outside, symbolizing their roles in the disaster. Soft lighting highlights the dramatic atmosphere of the crash without text or quotes.",generated_images\news_66f85ed2.png,https://www.kenyans.co.ke/news/113113-two-kenya-air-force-officers-killed-kwale-plane-crash,66f85ed2c261e3986d440919fcffc5ed,2025-06-15T11:21:25.283501
Babu Owino Sounds Alarm Over Masked Police at Protests,Babu Owino! 🚨 Alert! 🕰 Police in Mask! 🔥 Protests!,"Embakasi East MP Paul Ongili, popularly known as Babu Owino, has called on Inspector General of Police Douglas Kanja to enforce a court ruling that bars police officers from wearing facial masks during protests.
In an official statement, Babu condemned the continued defiance of the ruling issued by Justice Bahati Mwamuye, which declared the use of masks by officers during public demonstrations unconstitutional.
Justice Mwamuye ruled that the use of face coverings by law enforcement officers, especially during protests, violates the principles of accountability and transparency and hinders the identification of state agents when exercising coercive power.
The MP expressed his frustrations that, despite the ruling, officers continued covering their faces during public protests.
Embakasi Member of Babu Owino on May 23, 2025. TWITTER MP BABU OWINO
“It is unacceptable that despite this judicial pronouncement, certain elements within the police service continue to disregard the law with impunity,” Babu stated.
To ensure that the police remain compliant with this ruling, Babu has called upon Kanja to issue an immediate directive that will ensure the police are following the rule.
“No officer should engage the public in anonymity, especially while wielding force in the name of the state,” Babu continued.
According to the MP, Kenya should not be left to slide back into a culture of faceless repression. Babu emphasised the importance of all Kenyans, including officers, obeying the law.
“The law is clear, and it must be obeyed by all, especially by those entrusted to enforce it,” the MP continued.
Police officers have been spotted covering their faces during public protests while using force to disperse Kenyans. The latest case was witnessed on Thursday, June 12.
During the protests, where Kenyans had taken to the streets to demand justice for Albert Ojwang, who had died in police custody, Shakira Wafula, an activist, approached an officer and forcibly pulled off his mask. The officer was part of a contingent deployed to repulse protesters who gathered in the city.
In videos that made the rounds online, Wafula was seen striving to reach for the cloth covering his face, which she grabbed and began pulling off while the officer tried to block her. She eventually pulled it off and quickly ran away.
The issue of masked police officers gained national attention during the 2024 Gen Z protests, when it was noted that these officers killed some protestors, but identifying them became difficult as they had hidden their faces.
Activist Shakira Wafula pulling off a mask from a police officer in Nairobi, June 12, 2025 FACEBOOK UGI MEDIA","Babu Owino, MP Embakasi East, has called for Inspector General of Police Douglas Kanja to enforce the court ruling that bars police officers from wearing face coverings during public protests. The ruling states that such use violates principles of accountability and transparency, hindering state identification during coercive actions. Babu expressed frustration at officers continuing to comply despite the ruling, urging Kanja to issue an immediate directive enforcing this rule. Meanwhile, activists like Shakira Wafula pulled off a face-covering trick from a police officer during a protest in Nairobi, June 12. The incident highlights public scrutiny overmasked police, which gained national attention following Gen Z protests where officers killed some protestors but faced difficulty identifying them due to face covering use. The issue of masked police has sparked calls for Kenyan society to reformed under the law.",Babu Owino! 🚨 Alert! 🕰 Police in Mask! 🔥 Protests! 🗣️,image_generation_failed,https://www.kenyans.co.ke/news/113112-babu-owino-slams-police-defying-court-order-masks-during-protests,b76d8e2e8e1b7c05d37504d442f794e9,2025-06-15T11:23:51.493504
