Question,Option A,Option B,Option C,Option D,Correct Answer
What clinical sign indicates disseminated intravascular coagulation in pregnancy?,Fetal growth cessation,Hypertension,Proteinuria,Bleeding and thrombocytopenia,Bleeding and thrombocytopenia
Which symptom suggests acute abdomen in pregnancy?,Early nausea,Urinary frequency,Backache,Severe abdominal pain,Severe abdominal pain
What is the effect of relaxin hormone during pregnancy?,Stimulate uterine contractions,Suppress immune response,Connective tissue remodeling,Increase blood glucose,Connective tissue remodeling
Which maternal complication is associated with postpartum hemorrhage?,Acute fatty liver of pregnancy,Gestational diabetes,Preeclampsia,Eclampsia,Acute fatty liver of pregnancy
Which complication is common following rupture of uterine scar during pregnancy?,Uterine rupture,Gestational diabetes,Placental abruption,Preeclampsia,Uterine rupture
What is the typical platelet count cutoff for thrombocytopenia in HELLP syndrome?,Less than 100000 per microliter,Less than 200000 per microliter,Less than 50000 per microliter,Less than 150000 per microliter,Less than 100000 per microliter
Which of the following is a fetal complication that also impacts maternal management in preeclampsia?,Congenital anomalies,Intrauterine growth restriction,Fetal hydrops,Fetal macrosomia,Intrauterine growth restriction
Which maternal complication can present with oliguria and acute renal failure during pregnancy?,Gestational diabetes,Severe preeclampsia,Placenta previa,Hemolytic anemia,Severe preeclampsia
What pregnancy complication is commonly complicated by placental abruption?,Ectopic pregnancy,Severe preeclampsia,Gestational diabetes,Molar pregnancy,Severe preeclampsia
Which of these is the most effective way to control seizures in eclampsia?,Diazepam,Carbamazepine,Magnesium sulfate,Phenytoin,Magnesium sulfate
What is a clinical hallmark of preeclampsia?,Hypotension and anemia,Increased fetal movements,Hypertension and proteinuria,Mild headache,Hypertension and proteinuria
What disorder should be considered when HELLP syndrome features overlap but with atypical presentation?,Thrombotic thrombocytopenic purpura,Gestational diabetes,Placenta previa,Preeclampsia,Thrombotic thrombocytopenic purpura
Which of the following is NOT considered a maternal complication of pregnancy trauma?,Placental abruption,Uterine rupture,Gestational diabetes,Hypovolemic shock,Gestational diabetes
What is the primary cause of pulmonary edema in severe preeclampsia?,Asthma,Capillary leak and myocardial dysfunction,Infection,Pulmonary embolism,Capillary leak and myocardial dysfunction
Which maternal complication may cause intrauterine fetal death due to placental insufficiency?,Gestational diabetes,Severe preeclampsia,Uterine prolapse,Hyperemesis gravidarum,Severe preeclampsia
What major complication in eclampsia is associated with an increased risk of future epilepsy?,Proteinuria,Recurrent seizures during pregnancy,Gestational diabetes,Hypertension,Recurrent seizures during pregnancy
What is the primary cause of acute renal failure in pregnancy complicated by preeclampsia?,Autoimmune nephritis,Renal vasospasm leading to ischemia,Urinary tract infection,Nephrolithiasis,Renal vasospasm leading to ischemia
Which of the following maternal complications involves platelet consumption causing bleeding risk?,Preeclampsia,Disseminated intravascular coagulation,Hyperemesis gravidarum,Uterine rupture,Disseminated intravascular coagulation
What pregnancy complication is indicated by elevated liver enzymes and right upper quadrant pain?,Gestational diabetes,HELLP syndrome,Preeclampsia,Uterine rupture,HELLP syndrome
Which maternal symptom is suggestive of severe preeclampsia?,Mild fatigue,Back pain,Weight gain,Headache and visual disturbances,Headache and visual disturbances
What complication is characterized by a platelet count less than 100,000 per microliter in pregnancy?,HELLP syndrome,Gestational diabetes,Uterine rupture,Eclampsia
Which maternal complication has the highest mortality during pregnancy?,Uterine rupture,Placenta previa,Eclampsia,Gestational diabetes,Eclampsia
What postpartum complication can arise from acute fatty liver of pregnancy?,Massive hemorrhage,Pulmonary embolism,Renal failure,Preeclampsia,Massive hemorrhage
Which is a typical maternal complication of intestinal obstruction during pregnancy?,Gestational diabetes,Preeclampsia,Hypertension,High maternal and fetal mortality,High maternal and fetal mortality
What is the hallmark of eclampsia?,Mild hypertension,Oligohydramnios,Seizures following preeclampsia,Uterine tenderness,Seizures following preeclampsia
Which of the following is a predisposing factor for maternal urinary tract infections in pregnancy?,Hyperglycemia,Physiological urinary stasis,Hypotension,Increased immunity,Physiological urinary stasis
What is the primary hormonal cause of ligamentous changes in pregnancy?,Relaxin,Estrogen,Progesterone,Testosterone,Relaxin
How is magnesium sulfate administered to manage eclampsia?,Subcutaneous injection,Oral administration only,Intramuscular injection,Intravenous loading followed by maintenance doses,Intravenous loading followed by maintenance doses
Which maternal complication causes proteinuria greater than 5 grams per day?,Gestational diabetes,Uterine rupture,Severe preeclampsia,Mild preeclampsia,Severe preeclampsia
Which maternal complication is characterized by severe hemolysis and thrombocytopenia and can be confused with HELLP syndrome?,Eclampsia,Thrombotic thrombocytopenic purpura,Preeclampsia,Uterine rupture,Thrombotic thrombocytopenic purpura
Which maternal complication is strongly associated with placental abruption?,Preeclampsia,Uterine rupture,Gestational diabetes,Disseminated intravascular coagulation,Disseminated intravascular coagulation
What maternal symptom often precedes eclamptic seizures?,Mild hypertension,Fatigue,Mild nausea,Severe hypertension and headaches,Severe hypertension and headaches
Which organ is at the highest risk of infarction and rupture in severe preeclampsia?,Heart,Lung,Liver,Kidney,Liver
Which of the following conditions is the least likely to cause preeclampsia?,Chronic hypertension,Gestational diabetes,Molar pregnancy,Uterine fibroids,Uterine fibroids
What is the most common cause of death in pregnancy complicated by eclampsia?,Myocardial infarction,Intracranial hemorrhage,Stroke,Pulmonary embolism,Intracranial hemorrhage
Which complication of pregnancy may cause cortical blindness in the mother?,Preeclampsia,Eclampsia,Gestational diabetes,Placenta previa,Eclampsia
Which of the following maternal conditions increases risk for intrauterine fetal death?,Maternal anemia,Severe preeclampsia,Uterine fibroids,Gestational diabetes,Severe preeclampsia
Which maternal condition in pregnancy is characterized by severe hypertension and proteinuria but no seizures?,Eclampsia,Preeclampsia,Placenta previa,Gestational diabetes,Preeclampsia
What is the maternal risk with untreated eclampsia?,Placenta previa,Mild hypertension,Gestational diabetes,Permanent CNS damage and death,Permanent CNS damage and death
Which of the following pregnancy complications is primarily diagnosed by elevated liver enzyme levels?,HELLP syndrome,Preeclampsia,Gestational diabetes,Placenta previa,HELLP syndrome
Which complication is a direct consequence of vasospasm and endothelial dysfunction in the kidney during preeclampsia?,Gestational diabetes,Acute renal failure,Pyelonephritis,Urinary tract infection,Acute renal failure
What symptom in preeclampsia indicates hepatic involvement?,Cough,Right upper quadrant pain and elevated enzymes,Leg edema,Polyuria,Right upper quadrant pain and elevated enzymes
Which maternal complication may result in pulmonary edema due to capillary leak?,Gestational diabetes,Eclampsia,Severe preeclampsia,Preeclampsia without proteinuria,Severe preeclampsia
Which fetal complication is common with maternal preeclampsia?,Polyhydramnios,Neural tube defects,Intrauterine growth restriction,Fetal macrosomia,Intrauterine growth restriction
Which maternal complication causes symptoms of microangiopathic hemolysis during pregnancy?,Gestational diabetes,Placenta previa,Preeclampsia,HELLP syndrome,HELLP syndrome
What is the typical treatment to reduce morbidity from eclampsia?,Steroids,Antihypertensives only,Magnesium sulfate,Anticonvulsants other than magnesium,Magnesium sulfate
What is a rare but fatal complication associated with pregnancy complicated by subcapsular hematoma?,Abruptio placenta,Gestational diabetes,Preeclampsia,Hepatic rupture,Hepatic rupture
Which maternal complication involves disseminated intravascular coagulation frequently?,Uterine rupture,Hyperemesis gravidum,Placental abruption,Gestational diabetes,Placental abruption
Which maternal complication can be mistaken for HELLP syndrome?,Thrombotic thrombocytopenic purpura,Eclampsia,Gestational diabetes,Preeclampsia,Thrombotic thrombocytopenic purpura
What is the outcome of intravascular coagulopathy in pregnancy?,Mild anemia,Improved fetal growth,Gestational diabetes,Severe bleeding and organ damage,Severe bleeding and organ damage
Which maternal complication is indicated by sudden severe abdominal pain and hemodynamic instability during pregnancy trauma?,Placental abruption,Eclampsia,Uterine rupture,Gestational diabetes,Uterine rupture
What pregnancy complication commonly presents with headache, visual changes, and severe hypertension?,Preeclampsia,Eclampsia,Uterine rupture
Which maternal complication frequently leads to acute kidney injury in severe preeclampsia?,Nephrolithiasis,Pyelonephritis,Interstitial nephritis,Acute tubular necrosis,Acute tubular necrosis
What is a defining feature of eclampsia?,Hypertension without seizures,Nausea and vomiting,Fever and chills,Seizures on top of preeclampsia features,Seizures on top of preeclampsia features
